{
  "$schema": "https://json-schema.org/draft/2020-12/schema",
  "$id": "https://patchmesh.dev/schemas/phase0/v1/decision.schema.json",
  "$defs": {
    "target": { "type": "object", "properties": { "agentId": { "$ref": "./identities.schema.json#/$defs/agentId" }, "taskId": { "$ref": "./identities.schema.json#/$defs/taskId" } }, "required": ["agentId", "taskId"], "additionalProperties": false },
    "delivery": { "type": "object", "properties": { "deliveryId": { "type": "string", "pattern": "^delivery_[0-9a-f]{32}$" }, "target": { "$ref": "#/$defs/target" }, "state": { "enum": ["pending", "delivered", "acknowledged", "failed"] }, "eventIds": { "type": "array", "items": { "$ref": "./identities.schema.json#/$defs/eventId" }, "uniqueItems": true } }, "required": ["deliveryId", "target", "state", "eventIds"], "additionalProperties": false }
  },
  "type": "object", "properties": {
    "decisionId": { "type": "string", "pattern": "^decision_[0-9a-f]{32}$" }, "findingId": { "type": "string", "pattern": "^finding_[0-9a-f]{32}$" }, "target": { "$ref": "#/$defs/target" }, "coordinationAction": { "enum": ["record", "notify", "request_recheck", "assign_owner", "redirect", "pause", "mark_possibly_stale", "mark_stale", "request_revalidation", "create_follow_up_task", "escalate"] }, "gatewayDirective": { "enum": ["allow", "allow_with_notice", "delay", "reject"] }, "reason": { "type": "string", "pattern": "^\\S(?:.*\\S)?$" }, "evidenceEventIds": { "type": "array", "items": { "$ref": "./identities.schema.json#/$defs/eventId" }, "minItems": 1, "uniqueItems": true }, "confidence": { "type": "number", "minimum": 0 }, "confidenceBand": { "enum": ["low", "medium", "high"] }, "policy": { "type": "object", "properties": { "policyId": { "type": "string", "pattern": "^policy_[a-z0-9][a-z0-9._-]{0,63}$" }, "version": { "type": "string", "pattern": "^\\S+$" } }, "required": ["policyId", "version"], "additionalProperties": false }, "expectedResponse": { "enum": ["affected", "not_affected", "already_handled", "needs_more_information"] }, "coverageIds": { "type": "array", "items": { "$ref": "./coverage.schema.json#/$defs/coverageId" }, "minItems": 1, "uniqueItems": true }, "state": { "enum": ["active", "resolved"] }, "deliveries": { "type": "array", "items": { "$ref": "#/$defs/delivery" } }
  }, "required": ["decisionId", "findingId", "target", "coordinationAction", "gatewayDirective", "reason", "evidenceEventIds", "confidence", "confidenceBand", "policy", "expectedResponse", "coverageIds", "state", "deliveries"], "additionalProperties": false
}
