[
  { "decisionId": "decision_00000000000000000000000000000001", "findingId": "finding_00000000000000000000000000000001", "target": { "agentId": "agent_b", "taskId": "task_consumer" }, "coordinationAction": "request_revalidation", "gatewayDirective": "allow_with_notice", "reason": "candidate authenticate signature differs from the consumer's observed signature", "evidenceEventIds": ["evt_00000000000000000000000000000002", "evt_00000000000000000000000000000004", "evt_00000000000000000000000000000007"], "confidence": 1, "confidenceBand": "high", "policy": { "policyId": "policy_exported_contract", "version": "1" }, "expectedResponse": "affected", "coverageIds": ["coverage_00000000000000000000000000000001"], "state": "active", "deliveries": [{ "deliveryId": "delivery_00000000000000000000000000000001", "target": { "agentId": "agent_b", "taskId": "task_consumer" }, "state": "acknowledged", "eventIds": ["evt_0000000000000000000000000000000c", "evt_0000000000000000000000000000000d", "evt_0000000000000000000000000000000e"] }] }
]
